### ISSUE TITLE
网络层面数据包都正常传递，也返回成功了。但是plc的db块数据就是没更新成功，有遇到过么？

### ISSUE THREAD

**Issue by minterjiang** [S7NetPlus/s7netplus#567]
Frame 5676303: 205 bytes on wire (1640 bits), 205 bytes captured (1640 bits) on interface \Device\NPF_{0441D740-045B-4588-A4DA-874A48E65C3A}, id 0
Ethernet II, Src: HuaweiTechno_1d:90:5a (a4:dc:be:1d:90:5a), Dst: HuaweiTechno_c2:aa:95 (10:24:07:c2:aa:95)
    Destination: HuaweiTechno_c2:aa:95 (10:24:07:c2:aa:95)
        .... ..0. .... .... .... .... = LG bit: Globally unique address (factory default)
        .... ...0 .... .... .... .... = IG bit: Individual address (unicast)
    Source: HuaweiTechno_1d:90:5a (a4:dc:be:1d:90:5a)
        .... ..0. .... .... .... .... = LG bit: Globally unique address (factory default)
        .... ...0 .... .... .... .... = IG bit: Individual address (unicast)
    Type: IPv4 (0x0800)
    [Stream index: 0]
Internet Protocol Version 4, Src: 172.30.53.4, Dst: 172.30.17.80
Transmission Control Protocol, Src Port: 58240, Dst Port: 102, Seq: 50620304, Ack: 37460198, Len: 151
TPKT, Version: 3, Length: 151
ISO 8073/X.224 COTP Connection-Oriented Transport Protocol
S7 Communication
    Header: (Job)
    Parameter: (Write Var)
    Data
        Item [1]: (Reserved)
            Return code: Reserved (0x00)
            Transport size: BYTE/WORD/DWORD (0x04)
            Length: 22
            Data: 1411524a45542d5a53502d4c392d3033393839000000
        Item [2]: (Reserved)
            Return code: Reserved (0x00)
            Transport size: BYTE/WORD/DWORD (0x04)
            Length: 4
            Data: 0000a03e
        Item [3]: (Reserved)
            Return code: Reserved (0x00)
            Transport size: BYTE/WORD/DWORD (0x04)
            Length: 2
            Data: 0000
        Item [4]: (Reserved)
            Return code: Reserved (0x00)
            Transport size: BYTE/WORD/DWORD (0x04)
            Length: 4
            Data: 0bf81371
        Item [5]: (Reserved)
            Return code: Reserved (0x00)
            Transport size: BYTE/WORD/DWORD (0x04)
            Length: 2
            Data: 0001
        Item [6]: (Reserved)
            Return code: Reserved (0x00)
            Transport size: BYTE/WORD/DWORD (0x04)
            Length: 2
            Data: 0001

ACK_DATA
Frame 5676304: 81 bytes on wire (648 bits), 81 bytes captured (648 bits) on interface \Device\NPF_{0441D740-045B-4588-A4DA-874A48E65C3A}, id 0
Ethernet II, Src: HuaweiTechno_c2:aa:95 (10:24:07:c2:aa:95), Dst: HuaweiTechno_1d:90:5a (a4:dc:be:1d:90:5a)
    Destination: HuaweiTechno_1d:90:5a (a4:dc:be:1d:90:5a)
        .... ..0. .... .... .... .... = LG bit: Globally unique address (factory default)
        .... ...0 .... .... .... .... = IG bit: Individual address (unicast)
    Source: HuaweiTechno_c2:aa:95 (10:24:07:c2:aa:95)
        .... ..0. .... .... .... .... = LG bit: Globally unique address (factory default)
        .... ...0 .... .... .... .... = IG bit: Individual address (unicast)
    Type: IPv4 (0x0800)
    [Stream index: 0]
Internet Protocol Version 4, Src: 172.30.17.80, Dst: 172.30.53.4
Transmission Control Protocol, Src Port: 102, Dst Port: 58240, Seq: 37460198, Ack: 50620455, Len: 27
TPKT, Version: 3, Length: 27
ISO 8073/X.224 COTP Connection-Oriented Transport Protocol
S7 Communication
    Header: (Ack_Data)
    Parameter: (Write Var)
    Data
        Item [1]: (Success)
            Return code: Success (0xff)
        Item [2]: (Success)
            Return code: Success (0xff)
        Item [3]: (Success)
            Return code: Success (0xff)
        Item [4]: (Success)
            Return code: Success (0xff)
        Item [5]: (Success)
            Return code: Success (0xff)
        Item [6]: (Success)
            Return code: Success (0xff)

往plc批量写了6个字段，ACK_DATA 6个参数都返回了success了。

频率比较低，1000次也就发生个1、2次。
但是就很麻烦，如果不能保证写入成功，所有写入都是不可靠的了，目前所有的写入都需要写入完成后再查询一次，看下是不是和写入的一样，但这样就增加了无意义的查询和写入。我是上位机侧，所以请教下有没有遇到过相同的问题。

**Comment by ynioba** [comment]
这是来自”麦冬@广西机械工业研究院”的邮箱自动回复邮件。您好，您的邮件已收到，我查阅后尽快回复您。
